[
  { "schoolId": "10487", "majorCode": "081200", "majorName": "计算机科学与技术", "studyType": "学硕", "year": 2023, "total": 320, "politics": 50, "english": 50, "mathOrPro": 80, "minAdmit": null, "avgAdmit": null, "planCount": null, "reason": "", "sourceUrl": "https://example.edu.cn/2023", "verified": false },
  { "schoolId": "10487", "majorCode": "081200", "majorName": "计算机科学与技术", "studyType": "学硕", "year": 2024, "total": 370, "politics": 60, "english": 60, "mathOrPro": 90, "minAdmit": null, "avgAdmit": null, "planCount": null, "reason": "", "sourceUrl": "https://m-jixun.iqihang.com/zixun/fenshuxian/2025640343.html", "verified": true },
  { "schoolId": "10487", "majorCode": "081200", "majorName": "计算机科学与技术", "studyType": "学硕", "year": 2025, "total": 328, "politics": 50, "english": 50, "mathOrPro": 75, "minAdmit": null, "avgAdmit": null, "planCount": null, "reason": "", "sourceUrl": "https://example.edu.cn/2025", "verified": false },
  { "schoolId": "10486", "majorCode": "081200", "majorName": "计算机科学与技术", "studyType": "学硕", "year": 2025, "total": 325, "politics": 50, "english": 50, "mathOrPro": 100, "minAdmit": null, "avgAdmit": null, "planCount": null, "reason": "学校基本线；各学院可在其上二次划线", "sourceUrl": "https://yz.chsi.com.cn/news/file.do?method=downFile&id=2293449002", "verified": true },
  { "schoolId": "10486", "majorCode": "085404", "majorName": "计算机技术", "studyType": "专硕", "year": 2025, "total": 320, "politics": 50, "english": 50, "mathOrPro": 90, "minAdmit": null, "avgAdmit": null, "planCount": null, "reason": "学校基本线", "sourceUrl": "https://yz.chsi.com.cn/news/file.do?method=downFile&id=2293449002", "verified": true },
  { "schoolId": "10486", "majorCode": "085405", "majorName": "软件工程", "studyType": "专硕", "year": 2025, "total": 320, "politics": 50, "english": 50, "mathOrPro": 90, "minAdmit": null, "avgAdmit": null, "planCount": null, "reason": "学校基本线", "sourceUrl": "https://yz.chsi.com.cn/news/file.do?method=downFile&id=2293449002", "verified": true }
]
